{
  "artifact_id": "ART-WR-FIX-001",
  "project_id": "PRJ-ANRI-2026-0808",
  "task_id": "TASK-WR-FIX-001",
  "parent_artifact_ids": [],
  "skill_id": "SKILL-WR",
  "skill_version": "0.1.0",
  "artifact_type": "writing_to_argue_record",
  "status": "READY_WITH_CONDITIONS",
  "task_contract": {"question_or_problem":"Should the school adopt the supplied reading policy?","purpose":"write an evidence-based recommendation","audience":"school decision-maker","grade_band_or_course":"secondary ELA","discipline_or_context":"civic writing","mode":"argument","constraints":["use supplied sources"],"burden_or_standard":"proportionate recommendation"},
  "payload": {
    "task_contract": {"purpose":"recommendation","audience":"school decision-maker","genre":"argument"},
    "claim_map": [{"claim_id":"CLM-WR-001","scope":"pilot the policy for one semester","evidence_ids":["EVD-WR-001"]}],
    "evidence_ledger": [{"evidence_id":"EVD-WR-001","source_id":"SRC-WR-001","locator":"p. 4, table 1","status":"verified"}],
    "commentary_map": [{"claim_id":"CLM-WR-001","commentary":"The evidence supports a bounded pilot, not permanent adoption.","warrant":"The source reports a limited context and therefore supports a qualified claim."}],
    "organization_plan": {"sequence":["context","evidence","alternative","recommendation"]},
    "revision_priorities": [{"priority":"claim scope","next_decision":"retain pilot qualifier"}],
    "alternative_plan": {"claim":"do not adopt","status":"strongest_relevant_alternative","response":"qualify"},
    "learner_checkpoints": [{"checkpoint":"final claim","decision_required":true}],
    "ai_use_and_authorship_log": [{"action":"asked questions about claim scope","human_confirmation":true}],
    "next_action":"Learner drafts the recommendation and records revision rationale."
  },
  "source_ids": ["SRC-WR-001"],
  "evidence_ids": ["EVD-WR-001"],
  "claim_ids": ["CLM-WR-001"],
  "uncertainty_ids": ["UNC-WR-001"],
  "provenance_ids": ["PROV-WR-001"],
  "learner_decisions": [{"decision_id":"DEC-WR-001","checkpoint":"claim scope","options_considered":["adopt","pilot","reject"],"selected_option":"pilot","reason":"matches evidence limits","artifact_effect":"qualifies recommendation"}],
  "ai_use_log": [{"action":"organized evidence questions","inputs":["EVD-WR-001"],"human_confirmation":true,"omissions_or_risks":["final wording remains learner-authored"]}],
  "accessibility_notes": [],
  "rights_and_permissions": [{"source_or_basis":"user-supplied source","status":"pending","note":"Use source only for this task."}],
  "unresolved_items": [],
  "qa_checks": [],
  "next_action": "Learner drafts and revises the recommendation."
}
